tvdb_id,series_name,num_seasons,poster,banner,fanart,status,first_aired,network,runtime,genre,overview,rating,imdb_id,tvdb_avg_rating,tvdb_ratings,my_rating
282254,BoJack Horseman,6,https://artworks.thetvdb.com/banners/posters/282254-6.jpg,https://artworks.thetvdb.com/banners/graphical/282254-g.jpg,https://artworks.thetvdb.com/banners/fanart/original/282254-8.jpg,Ended,2014-08-22,Netflix,25,"Animation, Comedy, Drama","Meet the most beloved sitcom horse of the '90s, 20 years later. He’s a curmudgeon with a heart of...not quite gold...but something like gold. Copper?",TV-MA,tt3398228,8.9,660,8.0
282670,Narcos,3,https://artworks.thetvdb.com/banners/posters/282670-9.jpg,https://artworks.thetvdb.com/banners/graphical/282670-g.jpg,https://artworks.thetvdb.com/banners/fanart/original/282670-9.jpg,Ended,2015-08-28,Netflix,50,"Action, Crime, Drama",A gritty chronicle of the war against Latin America's most notorious drug cartels.,TV-MA,tt2707408,8.9,2317,7.0
289108,American Crime Story,3,https://artworks.thetvdb.com/banners/posters/289108-8.jpg,https://artworks.thetvdb.com/banners/graphical/289108-g.jpg,https://artworks.thetvdb.com/banners/fanart/original/289108-31.jpg,Continuing,2016-02-02,FX,55,"Crime, Drama",An award-winning anthology series that examines some of America's most famous crimes. Each season is presented as a self-contained mini-series following unrelated true events.,TV-MA,tt2788432,9.4,331,7.0
289590,Mr. Robot,4,https://artworks.thetvdb.com/banners/posters/289590-12.jpg,https://artworks.thetvdb.com/banners/graphical/289590-g5.jpg,https://artworks.thetvdb.com/banners/fanart/original/289590-19.jpg,Ended,2015-06-24,USA Network,50,"Crime, Drama, Thriller","Mr. Robot follows Elliot, a young programmer who works as a cyber-security engineer by day and a vigilante hacker by night. Elliot finds himself at a crossroads when the mysterious leader of an underground hacker group recruits him to destroy the corporation.",TV-MA,tt4158110,9.0,4523,9.0
290508,The Night Manager,1,https://artworks.thetvdb.com/banners/posters/290508-6.jpg,https://artworks.thetvdb.com/banners/graphical/290508-g7.jpg,https://artworks.thetvdb.com/banners/fanart/original/290508-4.jpg,Ended,2016-02-21,BBC One,60,"Drama, Thriller","The contemporary interpretation of le Carre’s espionage drama - and the first TV adaptation of a le Carre novel in more than two decades - follows a former British soldier as he navigates the shadowy recesses of Whitehall and Washington where an alliance operates between the intelligence community and the secret arms trade, infiltrating the inner circle of arms dealer.",TV-14,tt1399664,8.5,651,6.0
292157,Taboo (2017),1,https://artworks.thetvdb.com/banners/posters/292157-1.jpg,https://artworks.thetvdb.com/banners/graphical/292157-g3.jpg,https://artworks.thetvdb.com/banners/fanart/original/292157-2.jpg,Continuing,2017-01-07,BBC One,60,"Action, Drama","James Keziah Delaney has been to the ends of the earth and comes back irrevocably changed. Believed to be long dead, he returns home to London from Africa to inherit what is left of his father's shipping empire and rebuild a life for himself. But his father's legacy is a poisoned chalice, and with enemies lurking in every dark corner, James must navigate increasingly complex territories to avoid his own death sentence. Encircled by conspiracy, murder and betrayal, a dark family mystery unfolds in a combustible tale of love and treachery.",TV-14,tt3647998,8.8,887,7.0
293088,One-Punch Man,2,https://artworks.thetvdb.com/banners/posters/293088-2.jpg,https://artworks.thetvdb.com/banners/graphical/293088-g2.jpg,https://artworks.thetvdb.com/banners/fanart/original/293088-2.jpg,Continuing,2015-10-04,TV Tokyo,25,"Action, Animation, Anime, Comedy, Science Fiction","Saitama is a superhero who has trained so hard that his hair has fallen out, and who can overcome any enemy with one punch. However, because he is so strong, he has become bored and frustrated that he wins all of his battles too easily.",TV-14,tt4508902,8.9,3848,8.0
295685,Lucifer,5,https://artworks.thetvdb.com/banners/posters/295685-9.jpg,https://artworks.thetvdb.com/banners/graphical/295685-g2.jpg,https://artworks.thetvdb.com/banners/fanart/original/295685-7.jpg,Continuing,2015-07-10,FOX,45,"Action, Comedy, Crime, Fantasy","Lucifer, the original fallen angel, is bored and unhappy in Hell and decides to retire to Los Angeles and open an upscale nightclub. After a murder takes place outside his club, he meets an intriguing homicide detective named Chloe, and partners up with her to solve cases.",TV-14,tt4052886,8.4,2390,4.0
295829,The Man in the High Castle,4,https://artworks.thetvdb.com/banners/posters/295829-7.jpg,https://artworks.thetvdb.com/banners/graphical/295829-g8.jpg,https://artworks.thetvdb.com/banners/fanart/original/295829-3.jpg,Ended,2015-01-15,Amazon,60,"Drama, Thriller","A glimpse into an alternate history of North America: what life after WWII might have been like if the Nazis had won the war. The Man in the High Castle explores daily life in 1962, fourteen years after the end of a longer Second World War (1939–1948 in this history). The victorious Axis Powers - Imperial Japan, Fascist Italy, and Nazi Germany - are conducting intrigues against each other in North America, specifically in the former U.S., which surrendered to them once they had conquered Eurasia and destroyed the populaces of Africa.",TV-PG,tt1740299,8.1,1424,6.0
296295,Ash vs Evil Dead,3,https://artworks.thetvdb.com/banners/posters/296295-2.jpg,https://artworks.thetvdb.com/banners/graphical/296295-g3.jpg,https://artworks.thetvdb.com/banners/fanart/original/296295-4.jpg,Ended,2015-07-10,Starz,30,"Comedy, Horror, Thriller","Ash has spent the last thirty years avoiding responsibility, maturity, and the terrors of the Evil Dead until a Deadite plague threatens to destroy all of mankind and Ash becomes mankind's only hope. ",TV-MA,tt4189022,8.7,1639,6.0
296762,Westworld,3,https://artworks.thetvdb.com/banners/posters/296762-3.jpg,https://artworks.thetvdb.com/banners/graphical/296762-g3.jpg,https://artworks.thetvdb.com/banners/fanart/original/296762-7.jpg,Continuing,2016-10-02,HBO,58,"Adventure, Drama, Science Fiction, Western","Westworld is a dark odyssey about the dawn of artificial consciousness and the evolution of sin. Set at the intersection of the near future and the reimagined past, it explores a world in which every human appetite, no matter how noble or depraved, can be indulged.",TV-MA,tt0475784,8.9,3255,8.0
298901,Master of None,2,https://artworks.thetvdb.com/banners/posters/298901-2.jpg,https://artworks.thetvdb.com/banners/graphical/298901-g2.jpg,https://artworks.thetvdb.com/banners/fanart/original/298901-14.jpg,Ended,2015-11-06,Netflix,30,"Comedy, Romance","The show follows the personal and professional lives of Dev, a 30-year-old actor who has trouble deciding what he wants to eat, much less the pathway for the rest of his life. Dev’s story takes him through subjects as diverse as the plight of the elderly, the immigrant experience, and how to find the most delicious pasta for dinner.",TV-MA,tt4635276,7.4,230,6.0
300166,Sneaky Pete,3,https://artworks.thetvdb.com/banners/posters/300166-3.jpg,https://artworks.thetvdb.com/banners/graphical/300166-g2.jpg,https://artworks.thetvdb.com/banners/fanart/original/300166-3.jpg,Ended,2015-08-07,Amazon,50,"Crime, Drama","After leaving prison, Marius takes cover from his past by assuming the identity of his cellmate Pete. He moves in with Pete's long-estranged unsuspecting family and is roped into the family's bail bond business. He's a criminal taking down other criminals and, in the process, discovers the family life he never had.",TV-MA,tt5011816,7.3,275,7.0
300472,Preacher,4,https://artworks.thetvdb.com/banners/posters/300472-3.jpg,https://artworks.thetvdb.com/banners/graphical/300472-g9.jpg,https://artworks.thetvdb.com/banners/fanart/original/300472-1.jpg,Ended,2016-05-22,AMC,40,"Adventure, Drama, Fantasy","What if an angel and a demon procreate? What would that offspring be? Would it be holy or demonic or both? Preacher is that tale. The offspring has no body, just a soul. That soul needs a body and chose Jesse Custer. A preacher from Texas with a loss of faith and a drinking problem. The offspring called Genesis bonds with Jesse, giving him the word of God. What he says is done.",TV-MA,tt5016504,8.5,1248,7.0
301824,11.22.63,1,https://artworks.thetvdb.com/banners/posters/301824-3.jpg,https://artworks.thetvdb.com/banners/graphical/301824-g.jpg,https://artworks.thetvdb.com/banners/fanart/original/301824-4.jpg,Ended,2016-02-15,Hulu,50,"Drama, Mini-Series, Science Fiction","Jake Epping, an ordinary high school teacher, is presented with a chance to change history. When a longtime friend shows Jake how to travel back in time, he tasks Jake with a mission he has been trying in vain to complete: stopping the assassination of John F. Kennedy on Nov. 22, 1963. Jake quickly learns that the past does not want to be changed, and that his attempts to divert the course of history can quickly turn dangerous.",TV-MA,tt2879552,8.0,1277,7.0
305288,Stranger Things,4,https://artworks.thetvdb.com/banners/posters/305288-4.jpg,https://artworks.thetvdb.com/banners/graphical/305288-g4.jpg,https://artworks.thetvdb.com/banners/fanart/original/305288-9.jpg,Continuing,2016-07-15,Netflix,50,"Adventure, Drama, Fantasy, Horror, Suspense","Tribute to the classic supernatural mysteries of the 80s, ""Stranger Things"" is the story of a boy who disappears in the small town of Hawkins, Indiana, without a trace in 1983. In his desperate search, both his friends and family and the local sheriff are involved in an extraordinary enigma: top-secret experiments, terrifying paranormal forces and a very, very rare girl ...",TV-14,tt4574334,9.2,4140,7.0
305574,The Crown,3,https://artworks.thetvdb.com/banners/posters/305574-3.jpg,https://artworks.thetvdb.com/banners/graphical/305574-g2.jpg,https://artworks.thetvdb.com/banners/fanart/original/305574-7.jpg,Continuing,2016-11-04,Netflix,60,Drama,"The inside story of two of the most famous addresses in the world – Buckingham Palace and 10 Downing Street – and the intrigues, love lives and machinations behind the great events that shaped the second half of the 20th century. Two houses. Two courts. One Crown.",TV-PG,tt4786824,8.9,692,8.0
305719,Big Little Lies,2,https://artworks.thetvdb.com/banners/posters/305719-4.jpg,https://artworks.thetvdb.com/banners/graphical/305719-g3.jpg,https://artworks.thetvdb.com/banners/fanart/original/305719-2.jpg,Continuing,2017-02-19,HBO,52,"Comedy, Crime, Drama, Suspense","Based on Liane Moriarty’s bestselling book, and featuring Reese Witherspoon, Nicole Kidman, and Shailene Woodley, this darkly comedic series tells the tale of three mothers whose seemingly perfect lives unravel to the point of murder. ",TV-MA,tt3920596,8.9,611,8.0
309765,Horace and Pete,1,https://artworks.thetvdb.com/banners/posters/309765-1.jpg,https://artworks.thetvdb.com/banners/graphical/309765-g.jpg,https://artworks.thetvdb.com/banners/fanart/original/309765-2.jpg,Ended,2016-01-30,Hulu,60,Drama,"The owners of a dive bar in Brooklyn, Horace and Pete, along with bar regulars share their experiences and lives with each other while drinking or working at the bar.",TV-MA,tt5425186,9.9,187,6.0
310516,The Night Of,1,https://artworks.thetvdb.com/banners/posters/310516-3.jpg,https://artworks.thetvdb.com/banners/graphical/310516-g.jpg,https://artworks.thetvdb.com/banners/fanart/original/310516-2.jpg,Ended,2016-07-10,HBO,55,"Crime, Drama, Mini-Series","After a night of partying with a female stranger, a man wakes up to find her stabbed to death and is charged with her murder.",TV-MA,tt2401256,8.7,779,9.0
311711,The Good Place,4,https://artworks.thetvdb.com/banners/posters/311711-3.jpg,https://artworks.thetvdb.com/banners/graphical/311711-g.jpg,https://artworks.thetvdb.com/banners/fanart/original/311711-10.jpg,Ended,2016-09-19,NBC,25,"Comedy, Fantasy, Romance","Eleanor Shellstrop is an ordinary woman who, through an extraordinary string of events, enters the afterlife where she comes to realize that she hasn't been a very good person. With the help of her wise afterlife mentor, she's determined to shed her old way of living and discover the awesome (or at least the pretty good) person within.",TV-14,tt4955642,8.7,693,6.0
312505,Dirk Gently's Holistic Detective Agency,2,https://artworks.thetvdb.com/banners/posters/312505-4.jpg,https://artworks.thetvdb.com/banners/graphical/312505-g2.jpg,https://artworks.thetvdb.com/banners/fanart/original/312505-3.jpg,Ended,2016-06-25,BBC America,45,"Comedy, Crime, Thriller","A group of social pariahs, with somewhat direct connections to the happenings of the universe, follow the holistic philosophy of ""everything is connected"". Dirk embraces being a weirdness magnet and is a self-styled ""holistic detective"". Dirk drags his unwitting and unwilling Dr. Watson, Todd, into his absurd ""cases"" that decipher how everything is connected.",TV-14,tt4047038,8.3,806,7.0
313969,The Young Pope,1,https://artworks.thetvdb.com/banners/posters/313969-3.jpg,https://artworks.thetvdb.com/banners/graphical/313969-g2.jpg,https://artworks.thetvdb.com/banners/fanart/original/313969-5.jpg,Ended,2016-10-21,Sky Atlantic (IT),60,Drama,"Lenny Belardo, the youngest and first American Pope in the history of the Church, must establish his new papacy and navigate the power struggles of the closed, secretive Vatican.",TV-PG,tt3655448,7.6,248,7.0
313999,Atlanta,4,https://artworks.thetvdb.com/banners/posters/313999-2.jpg,https://artworks.thetvdb.com/banners/graphical/313999-g6.jpg,https://artworks.thetvdb.com/banners/fanart/original/313999-10.jpg,Continuing,2016-09-06,FX,25,"Comedy, Drama","Two cousins, with different views on art versus commerce, on their way up through the Atlanta rap scene; Earnest 'Earn' Marks, an ambitious college dropout and his estranged cousin, who suddenly becomes a star.",TV-MA,tt4288182,8.5,524,7.0
314614,Fleabag,2,https://artworks.thetvdb.com/banners/posters/314614-3.jpg,https://artworks.thetvdb.com/banners/graphical/314614-g.jpg,https://artworks.thetvdb.com/banners/fanart/original/314614-1.jpg,Ended,2016-07-21,BBC Three,25,"Comedy, Drama","Meet Fleabag. She’s not talking to all of us; she’s talking to YOU. So why don’t you pop your top off and come right in?

Fleabag is a hilarious and poignant window into the mind of a dry-witted, sexual, angry, porn-watching, grief-riddled woman trying to make sense of the world.",TV-MA,tt5687612,8.6,274,8.0
315321,Goliath,4,https://artworks.thetvdb.com/banners/posters/315321-2.jpg,https://artworks.thetvdb.com/banners/graphical/315321-g.jpg,https://artworks.thetvdb.com/banners/fanart/original/315321-3.jpg,Continuing,2016-10-14,Amazon,55,Drama,"Once a powerful lawyer, Billy McBride is now burned out and washed up, spending more time in a bar than a courtroom. When he reluctantly agrees to pursue a wrongful death lawsuit against the biggest client of Cooperman & McBride, the massive law firm he helped create, Billy and his ragtag team uncover a vast and deadly conspiracy, pitting them all in a life or death trial against the ultimate Goliath.",TV-14,tt4687880,7.4,208,7.0
317728,The Deuce,3,https://artworks.thetvdb.com/banners/posters/317728-3.jpg,https://artworks.thetvdb.com/banners/graphical/317728-g3.jpg,https://artworks.thetvdb.com/banners/fanart/original/317728-1.jpg,Ended,2017-09-10,HBO,60,Drama,"This drama series follows the legalization and subsequent rise of the porn industry in New York from the early 1970s through the mid-1980s, exploring the rough-and-tumble world of midtown Manhattan. James Franco stars as real-life twin brothers who were players in the Times Square world and became fronts for mob control of the volatile and lucrative sex industry from its beginnings.",TV-MA,tt4998350,9.0,386,5.0
320724,Legion,3,https://artworks.thetvdb.com/banners/posters/320724-1.jpg,https://artworks.thetvdb.com/banners/graphical/320724-g3.jpg,https://artworks.thetvdb.com/banners/fanart/original/320724-3.jpg,Ended,2017-02-08,FX,45,"Action, Drama, Science Fiction, Thriller","David was diagnosed with schizophrenia at a young age, and has been a patient in various psychiatric hospitals since. After Haller has an encounter with a fellow psychiatric patient, he is confronted with the possibility that there may be more to him than mental illness.",TV-14,tt5114356,8.5,1161,4.0
321060,The OA,2,https://artworks.thetvdb.com/banners/posters/321060-3.jpg,https://artworks.thetvdb.com/banners/graphical/321060-g3.jpg,https://artworks.thetvdb.com/banners/fanart/original/321060-2.jpg,Ended,2016-12-16,Netflix,71,"Drama, Mystery, Science Fiction, Suspense, Thriller","Seven years after vanishing from her home, a young woman returns with mysterious new abilities and recruits five strangers for a secret mission.",TV-MA,tt4635282,8.3,556,6.0
321239,The Handmaid's Tale,3,https://artworks.thetvdb.com/banners/posters/321239-3.jpg,https://artworks.thetvdb.com/banners/graphical/321239-g3.jpg,https://artworks.thetvdb.com/banners/fanart/original/321239-3.jpg,Continuing,2017-04-26,Hulu,49,Drama,"In a dystopian near-future, the totalitarian and Christian-fundamentalist government of Gilead rules the former United States amidst an ongoing civil war and subjugates women, who are not allowed to work, control money, or even read. Widespread infertility due to environmental contamination has resulted in the conscription of young fertile women—called Handmaids, according to biblical precedent—who are assigned to the homes of the elite, where they must have ritualized sex with the men in order to become pregnant and bear children for those men and their wives.",TV-MA,tt5834204,8.9,891,8.0
322191,The Terror,2,https://artworks.thetvdb.com/banners/posters/322191-1.jpg,https://artworks.thetvdb.com/banners/graphical/322191-g5.jpg,https://artworks.thetvdb.com/banners/fanart/original/322191-2.jpg,Continuing,2018-03-26,AMC,50,"Adventure, Drama, Horror, Suspense, Thriller",A chilling anthology drama series inspired by true historical events.,TV-MA,tt2708480,8.3,260,7.0
324835,GLOW,3,https://artworks.thetvdb.com/banners/posters/324835-5.jpg,https://artworks.thetvdb.com/banners/graphical/324835-g2.jpg,https://artworks.thetvdb.com/banners/fanart/original/324835-6.jpg,Continuing,2017-06-23,Netflix,35,Comedy,A look at the personal and professional lives of a group of women who perform for a wrestling organization in Los Angeles.,TV-MA,tt5770786,9.2,144,5.0
326791,The Marvelous Mrs. Maisel,4,https://artworks.thetvdb.com/banners/posters/326791-3.jpg,https://artworks.thetvdb.com/banners/graphical/326791-g3.jpg,https://artworks.thetvdb.com/banners/fanart/original/326791-3.jpg,Continuing,2017-03-16,Amazon,55,"Comedy, Drama","It’s 1958 Manhattan and Miriam 'Midge' Maisel has everything she’s ever wanted—the perfect husband, kids and Upper West Side apartment. But when her life suddenly takes a turn and Midge must start over, she discovers a previously unknown talent—one that will take her all the way from the comedy clubs of Greenwich Village to a spot on Johnny Carson’s couch.",TV-MA,tt5788792,8.3,187,8.0
328708,MINDHUNTER,2,https://artworks.thetvdb.com/banners/posters/328708-7.jpg,https://artworks.thetvdb.com/banners/graphical/328708-g4.jpg,https://artworks.thetvdb.com/banners/fanart/original/328708-3.jpg,Continuing,2017-10-13,Netflix,55,"Crime, Drama, Thriller",In the late 1970s two FBI agents expand criminal science by delving into the psychology of murder and getting uneasily close to all-too-real monsters.,TV-MA,tt5290382,8.7,314,9.0
329079,The Defiant Ones,1,https://artworks.thetvdb.com/banners/posters/329079-4.jpg,https://artworks.thetvdb.com/banners/graphical/329079-g2.jpg,https://artworks.thetvdb.com/banners/fanart/original/329079-3.jpg,Ended,2017-07-09,HBO,60,"Documentary, Mini-Series","A four-part documentary series that tells the stories of Jimmy Iovine and Dr. Dre -- one the son of a Brooklyn longshoreman, the other straight out of Compton -- their improbable partnership and surprising leading roles in a series of transformative events in contemporary culture.",TV-MA,tt6958022,8.5,53,
329083,Philip K. Dick's Electric Dreams,1,https://artworks.thetvdb.com/banners/posters/329083-5.jpg,https://artworks.thetvdb.com/banners/graphical/329083-g3.jpg,https://artworks.thetvdb.com/banners/fanart/original/329083-2.jpg,Ended,2017-09-17,Channel 4,50,Science Fiction,"A sci-fi anthology series of epic, ambitious and moving standalone episodes - each set in a different and unique world, inspired by one of Philip K. Dick’s renowned short stories.",TV-MA,tt5711280,6.9,414,6.0
329089,Ozark,3,https://artworks.thetvdb.com/banners/posters/329089-2.jpg,https://artworks.thetvdb.com/banners/graphical/329089-g2.jpg,https://artworks.thetvdb.com/banners/fanart/original/329089-4.jpg,Continuing,2017-08-02,Netflix,60,"Crime, Drama, Thriller","A financial adviser drags his family from Chicago to the Missouri Ozarks, where he must launder $500 million in five years to appease a drug boss.",TV-MA,tt5071412,9.1,361,8.0
331600,Castle Rock,2,https://artworks.thetvdb.com/banners/posters/5db98c9265d96.jpg,https://artworks.thetvdb.com/banners/graphical/5b9fe35772e6d.jpg,https://artworks.thetvdb.com/banners/fanart/original/5b844a96b02ee.jpg,Continuing,2018-07-19,Hulu,50,"Drama, Horror, Suspense, Thriller","A psychological-horror series set in the Stephen King multiverse combining the mythological scale and intimate character storytelling of King’s best-loved works, weaving an epic saga of darkness and light, played out on a few square miles of Maine woodland.",TV-MA,tt6548228,10.0,29,8.0
332331,Altered Carbon,2,https://artworks.thetvdb.com/banners/posters/332331-8.jpg,https://artworks.thetvdb.com/banners/graphical/332331-g3.jpg,https://artworks.thetvdb.com/banners/fanart/original/332331-2.jpg,Continuing,2018-02-02,Netflix,50,"Action, Drama, Science Fiction, Thriller","After 250 years on ice, a prisoner returns to life in a new body with one chance to win his freedom: by solving a mind-bending murder.",TV-MA,tt2261227,8.5,617,4.0
332353,Final Space,2,https://artworks.thetvdb.com/banners/posters/332353-2.jpg,https://artworks.thetvdb.com/banners/text/332353.jpg,https://artworks.thetvdb.com/banners/fanart/original/332353-2.jpg,Continuing,2016-04-05,Adult Swim,20,"Adventure, Animation, Comedy, Science Fiction","An astronaut named Gary and his planet-destroying sidekick Mooncake embark on serialized journeys through space in order to unlock the mystery of “Final Space,” the last point in the universe, if it actually does exist.",TV-14,tt6317068,9.4,189,6.0
332858,Cobra Kai,2,https://artworks.thetvdb.com/banners/posters/332858-2.jpg,https://artworks.thetvdb.com/banners/graphical/332858-g.jpg,https://artworks.thetvdb.com/banners/fanart/original/332858-1.jpg,Continuing,1984-06-22,YouTube,30,"Action, Drama","Cobra Kai takes place 30 years after the events of the 1984 All Valley Karate Tournament and finds Johnny Lawrence on the hunt for redemption by reopening the infamous Cobra Kai karate dojo. This reignites his old rivalry with the successful Daniel LaRusso, who has been working to maintain the balance in his life without mentor Mr. Miyagi.",TV-14,tt7221388,10.0,29,7.0
333072,Barry,2,https://artworks.thetvdb.com/banners/posters/333072-3.jpg,https://artworks.thetvdb.com/banners/graphical/333072-g2.jpg,https://artworks.thetvdb.com/banners/fanart/original/333072-3.jpg,Continuing,2018-03-25,HBO,30,"Comedy, Crime, Drama","After following his intended target to an acting class, a hitman finds himself intrigued and decides to become an actor and change his life.",TV-MA,tt5348176,7.8,120,8.0
333801,Godless,1,https://artworks.thetvdb.com/banners/posters/333801-2.jpg,https://artworks.thetvdb.com/banners/graphical/333801-g2.jpg,https://artworks.thetvdb.com/banners/fanart/original/333801-7.jpg,Ended,2017-11-22,Netflix,70,"Drama, Mini-Series, Western","Notorious criminal Frank Griffin and his gang of outlaws are on a mission of revenge against Roy Goode, a son-like protégé who betrayed the brotherhood. While on the run, Roy seeks refuge with hardened widower Alice Fletcher, an outcast herself, in a worn-down, isolated mining town of La Belle, NM — governed mainly by women. When word reaches La Belle that Griffin is headed their way, the town bands together to defend against the murderous gang in a lawless western frontier.",TV-14,tt5516154,8.9,250,8.0
336261,Tom Clancy's Jack Ryan,2,https://artworks.thetvdb.com/banners/posters/336261-2.jpg,https://artworks.thetvdb.com/banners/graphical/336261-g.jpg,https://artworks.thetvdb.com/banners/fanart/original/336261-1.jpg,Continuing,2018-08-31,Amazon,45,"Action, Drama, Thriller","An up-and-coming CIA analyst, Jack Ryan, is thrust into a dangerous field assignment as he uncovers a pattern in terrorist communication that launches him into the center of a dangerous gambit. ",TV-MA,tt5057054,9.4,143,2.0
336522,The End of the F***ing World,2,https://artworks.thetvdb.com/banners/posters/336522-1.jpg,https://artworks.thetvdb.com/banners/graphical/5d30afd8c12a8.jpg,https://artworks.thetvdb.com/banners/fanart/original/336522-5.jpg,Ended,2017-10-24,Channel 4,21,"Comedy, Drama, Romance","James is a 17-year-old who believes he is a psychopath. He kills animals as a hobby, but grows bored of the practice. He decides he wants to try killing a human. He settles on Alyssa, a mouthy, rebellious 17-year-old classmate with issues of her own. She proposes they run away together, hoping for an adventure away from her turbulent home-life, and James agrees with the intention of finding an opportunity to kill her. They embark on a road trip across England, and begin to develop a relationship after a series of mishaps.",TV-MA,tt6257970,8.3,435,5.0
