tvdb_id,series_name,num_seasons,poster,banner,fanart,status,first_aired,network,runtime,genre,overview,rating,imdb_id,tvdb_avg_rating,tvdb_ratings,my_rating
337302,Counterpart,2,https://artworks.thetvdb.com/banners/posters/337302-4.jpg,https://artworks.thetvdb.com/banners/graphical/337302-g6.jpg,https://artworks.thetvdb.com/banners/fanart/original/337302-2.jpg,Ended,2018-01-21,Starz,55,"Drama, Science Fiction, Thriller","After discovering that the spy agency he works for is hiding a gateway to a parallel dimension, a low-level UN bureaucrat in Berlin is thrust into a shadow world of intrigue and danger and must determine if he can trust his near-identical counterpart in the other world.",TV-MA,tt4643084,8.3,464,5.0
338946,Patrick Melrose,1,https://artworks.thetvdb.com/banners/posters/338946-2.jpg,https://artworks.thetvdb.com/banners/graphical/5af95c0539a34.jpg,https://artworks.thetvdb.com/banners/fanart/original/338946-1.jpg,Ended,2018-05-12,Showtime,60,"Drama, Mini-Series","Based on the acclaimed Patrick Melrose series of semi-autobiographical novels written by Edward St. Aubyn, Melrose hilariously skewers the upper class as it tracks the protagonist’s harrowing odyssey from a deeply traumatic childhood through adult substance abuse, and ultimately, towards recovery.
Benedict Cumberbatch will play Melrose, an aristocratic and outrageously funny playboy, who struggles to overcome the damage inflicted by an abusive father and a mother who tacitly condoned the behaviour",TV-MA,tt6586318,0.0,0,4.0
340959,Killing Eve,3,https://artworks.thetvdb.com/banners/series/340959/posters/5e8336febba23.jpg,https://artworks.thetvdb.com/banners/graphical/340959-g2.jpg,https://artworks.thetvdb.com/banners/series/340959/backgrounds/5e83372f86eb0.jpg,Continuing,2018-04-08,BBC America,40,"Action, Adventure, Thriller","When a top international assassin murders an influential politician, she comes up against an equally relentless MI5 intelligence analyst who is determined to bring her to justice.",TV-14,tt7016936,8.0,81,7.0
345246,The Haunting of Hill House,2,https://artworks.thetvdb.com/banners/posters/5bf912bbca206.jpg,https://artworks.thetvdb.com/banners/graphical/5ba3f39187984.jpg,https://artworks.thetvdb.com/banners/fanart/original/5baf64b8d34a9.jpg,Continuing,2018-10-12,Netflix,60,"Drama, Horror, Suspense, Thriller","Flashing between past and present, a fractured family confronts haunting memories of their old home and the terrifying events that drove them from it.",TV-MA,tt6763664,10.0,29,
347507,After Life,3,https://artworks.thetvdb.com/banners/posters/5c74559d04961.jpg,https://artworks.thetvdb.com/banners/graphical/5c8291b90cf98.jpg,https://artworks.thetvdb.com/banners/fanart/original/5c8253fc39093.jpg,Continuing,2019-03-08,Netflix,25,"Comedy, Drama","After Life follows Tony, who had a perfect life. But after his wife Lisa suddenly dies, Tony changes. After contemplating taking his own life, he decides instead to live long enough to punish the world by saying and doing whatever he likes from now on. He thinks it’s like a Super Power — not caring about himself or anyone else — but it turns out to be tricky when everyone is trying to save the nice guy they used to know.",TV-MA,tt8398600,9.0,55,7.0
353232,Narcos: Mexico,2,https://artworks.thetvdb.com/banners/series/353232/posters/62080133.jpg,https://artworks.thetvdb.com/banners/graphical/5bcd1fd7a7a81.jpg,https://artworks.thetvdb.com/banners/fanart/original/5be4ae1e9db24.jpg,Continuing,2018-11-16,Netflix,55,"Action, Adventure, Crime, Drama",A chronicle of the birth of the Mexican drug war in the 1980s and the true story of the Guadalajara cartel's ascent.,TV-MA,tt8714904,0.0,0,5.0
355567,The Boys,2,https://artworks.thetvdb.com/banners/posters/5c5c402b075cc.jpg,https://artworks.thetvdb.com/banners/graphical/5d1206432f318.jpg,https://artworks.thetvdb.com/banners/fanart/original/5d1200d70e4fe.jpg,Continuing,2019-07-26,Amazon,60,"Action, Adventure, Science Fiction","In a world where superheroes embrace the darker side of their massive celebrity and fame, The Boys centres on a group of vigilantes known informally as ""The Boys,"" who set out to take down corrupt superheroes with no more than blue collar grit and a willingness to fight dirty.",TV-MA,tt1190634,7.0,27,9.0
356609,Conversations with a Killer: The Ted Bundy Tapes,1,https://artworks.thetvdb.com/banners/posters/5c3cf6c131782.jpg,https://artworks.thetvdb.com/banners/graphical/5c3d4894d7300.jpg,https://artworks.thetvdb.com/banners/series/356609/backgrounds/5ef9fb7bd1633.jpg,Ended,2019-01-24,Netflix,60,"Crime, Documentary, Mini-Series","Present-day interviews, archival footage and audio recordings made on death row form a searing portrait of notorious serial killer Ted Bundy.",TV-MA,tt9425132,7.0,27,
357888,"Love, Death & Robots",2,https://artworks.thetvdb.com/banners/posters/5c8e831fd8a2c.jpg,https://artworks.thetvdb.com/banners/series/357888/banners/61998139.jpg,https://artworks.thetvdb.com/banners/fanart/original/5c9057304a595.jpg,Continuing,2019-03-15,Netflix,10,"Action, Animation, Fantasy, Mini-Series, Science Fiction","A collection of animated short stories that span various genres including science fiction, fantasy, horror and comedy.",TV-MA,tt9561862,10.0,22,7.0
359569,Good Omens,1,https://artworks.thetvdb.com/banners/posters/5c65fa5e7fa62.jpg,https://artworks.thetvdb.com/banners/graphical/5c899cdc2b713.jpg,https://artworks.thetvdb.com/banners/fanart/original/5c65faebc315e.jpg,Ended,2018-07-20,Amazon,60,"Comedy, Fantasy, Mini-Series","The End of the World is coming, which means a fussy Angel and a loose-living Demon who've become overly fond of life on Earth are forced to form an unlikely alliance to stop Armageddon. But they have lost the Antichrist, an 11-year-old boy unaware he's meant to bring upon the end of days, forcing them to embark on an adventure to find him and save the world before it's too late.",TV-MA,tt1869454,0.0,0,6.0
360388,When They See Us,1,https://artworks.thetvdb.com/banners/posters/5cf14507193f2.jpg,https://artworks.thetvdb.com/banners/graphical/5cd34668182fd.jpg,https://artworks.thetvdb.com/banners/fanart/original/5d9b702cb2c24.jpg,Ended,2019-05-31,Netflix,75,"Mini-Series, Thriller",Five teens from Harlem become trapped in a nightmare when they're falsely accused of a brutal attack in Central Park. Based on the true story.,TV-MA,tt7137906,0.0,0,7.0
360893,Chernobyl,1,https://artworks.thetvdb.com/banners/posters/5cc12861c93e4.jpg,https://artworks.thetvdb.com/banners/graphical/5cc9f74c2ddd3.jpg,https://artworks.thetvdb.com/banners/series/360893/backgrounds/62017319.jpg,Ended,2019-05-06,HBO,65,"Drama, History, Mini-Series",Chernobyl dramatizes the story of the 1986 nuclear accident — one of the worst man-made catastrophes in history — and the sacrifices made to save Europe from unimaginable disaster.,TV-MA,tt7366338,8.7,83,10.0
361753,The Mandalorian,1,https://artworks.thetvdb.com/banners/posters/5d603276729a5.jpg,https://artworks.thetvdb.com/banners/series/361753/banners/62000530.jpg,https://artworks.thetvdb.com/banners/fanart/original/5d6032b2e1bd4.jpg,Continuing,2019-11-12,Disney+,45,"Action, Adventure, Science Fiction","“The Mandalorian” is set after the fall of the Empire and before the emergence of the First Order. We follow the travails of a lone gunfighter in the outer reaches of the galaxy, far from the authority of the New Republic.",TV-PG,tt8111088,0.0,0,6.0
362696,The Witcher,1,https://artworks.thetvdb.com/banners/series/362696/posters/62003331.jpg,https://artworks.thetvdb.com/banners/graphical/5d1a2cb6138b3.jpg,https://artworks.thetvdb.com/banners/series/362696/backgrounds/62032150.jpg,Continuing,2019-12-20,Netflix,60,"Adventure, Fantasy","Geralt of Rivia, a solitary monster hunter, struggles to find his place in a world where people often prove more wicked than beasts.",TV-MA,tt5180504,0.0,0,6.0
365480,The Outsider (2020),1,https://artworks.thetvdb.com/banners/series/365480/posters/62042220.jpg,https://artworks.thetvdb.com/banners/series/365480/banners/62051524.jpg,https://artworks.thetvdb.com/banners/series/365480/backgrounds/62017905.jpg,Ended,2020-01-12,HBO,55,"Crime, Drama, Mini-Series, Mystery, Thriller","Based on Stephen King’s bestselling novel of the same name, The Outsider begins by following a seemingly straightforward investigation into the gruesome murder of a young boy. But when an insidious supernatural force edges its way into the case, it leads a seasoned cop and an unorthodox investigator to question everything they believe in.",TV-MA,tt8550800,0.0,0,7.0

